{
  "_id": "sha256:9f86d081884c7d659a2feaa0c55ad015a3bf4f1b2b0b822cd15d6c15b0f00a08",
  "schema_version": 1,
  "media_type": "video/mp4",
  "size_bytes": 21745263,
  "sources": [
    {
      "source_id": "local",
      "asset_id": "asset-3fa85f64d1a2b3c4",
      "uri": "file:///srv/media/sample-30s.mp4",
      "filename": "sample-30s.mp4",
      "size_bytes": 21745263,
      "modified_at": "2026-10-20T08:15:30Z",
      "entitlements": ["public"],
      "seen_at": "2026-10-27T09:00:00Z"
    },
    {
      "source_id": "library",
      "asset_id": "asset-0123456789abcdef",
      "uri": "file:///mnt/library/2026/talk.mp4",
      "filename": "talk.mp4",
      "size_bytes": 21745263,
      "modified_at": "2026-10-19T17:02:11Z",
      "entitlements": ["team-platform"],
      "seen_at": "2026-10-27T09:00:00Z"
    }
  ],
  "first_seen_at": "2026-10-27T09:00:00Z",
  "lineage": {
    "step": "ingestion",
    "fingerprint": "c7a1e2d3f405",
    "inputs": [],
    "version": "sha256:9f86d081884c7d659a2feaa0c55ad015a3bf4f1b2b0b822cd15d6c15b0f00a08",
    "image": null
  },
  "retired_at": null
}
